<?xml version="1.0" encoding="UTF-8"?>
<toc
	xmlns:xsi="http://www.w3.org/2001/XMLSchema-instance"
	xsi:noNamespaceSchemaLocation="toc.xsd">
	<body fileref="B0000001.dat">
		<original-name>cover-letter.html</original-name>
		<!-- digest-values are always _after_ encryption if encryption is used -->
		<digest-algo>SHA-256</digest-algo>
		<digest-value>b402f2558d1a0c6459a141688d42d9b1723aaf0d9d491b774157ea02e78ff983</digest-value>
	</body>
	<attachment-list>
		<attachment fileref="A0000001.dat">
			<original-name>HR-V1_web.pdf</original-name>
			<digest-algo>SHA-256</digest-algo>
			<!-- digest-values are always _after_ encryption if encryption is used -->
			<digest-value>c9cd8bcc4fc98c630dbdb1efa312cbedde677446c37559f4cb032d97bd8910df</digest-value>
		</attachment>
		<attachment fileref="A0000002.dat">
			<original-name>dpr-data.xlsx</original-name>
			<digest-algo>SHA-256</digest-algo>
			<!-- digest-values are always _after_ encryption if encryption is used -->
			<digest-value>75a55a62f6864f1084fbb4c12bbc3c4bb42e7ca7928f7d801e9f35a68847b81a</digest-value>
		</attachment>
	</attachment-list>
	<link-list>
		<link src="http://edrms.nraa.gov.om/permid=30a8j2we89">Online Report 1</link>
		<link src="http://edrms.nraa.gov.om/permid=20d7p2ss54">Online Report 2</link>
	</link-list>
</toc>
